{
  "sources": [
    "dashboard/app/controllers/passwords_controller.rb",
    "dashboard/app/views/devise/passwords/new.html.haml"
  ],
  "tests": [],
  "routes": ["GET /users/password/new", "POST /users/password", "GET /users/password/edit"],
  "flags": [],
  "journey": "frontend/packages/e2e-tests/docs-journeys/sign-in-student.spec.ts",
  "verification": {
    "result": "STRONGLY_SUPPORTED",
    "revision": "9793f8d36ae",
    "date": "2026-09-09",
    "notes": "Password reset form confirmed from haml template. Button label Submit asserted conditionally by journey (reCAPTCHA may block). Troubleshooting sections added for error and signed-in redirect."
  },
  "screenshots": [],
  "unresolved": []
}
