{
  "sources": [
    "apps/src/aichat/views/accessControls/AiChatAccessControls.tsx",
    "apps/src/templates/teacherNavigation/TeacherNavigationPaths.tsx",
    "apps/src/templates/teacherNavigation/TeacherNavigationBar.tsx",
    "dashboard/app/controllers/api/v1/sections_controller.rb",
    "dashboard/app/helpers/aichat_access_helper.rb",
    "dashboard/app/models/sections/section.rb",
    "lib/cdo/shared_constants.rb",
    "apps/src/aiComponentLibrary/aiChatToolsDependencyAlerts/AssigningEssentialAiChatToolsAlert.tsx",
    "apps/i18n/common/en_us.json"
  ],
  "tests": [],
  "routes": [
    "PATCH /dashboardapi/sections/:id/ai_chat_access_level"
  ],
  "flags": [
    "aichat_access_units"
  ],
  "journey": null,
  "verification": {
    "result": "STRONGLY_SUPPORTED",
    "revision": "9793f8d36ae",
    "date": "2026-09-09",
    "notes": "UI label 'AI Settings' from en_us.json. Access levels from SharedConstants. Auto-enable logic from AichatAccessHelper. Verified teacher requirement from AiChatAccessControls alert text. Journey deferred: requires a section assigned to an AI-Chat-bearing course."
  },
  "screenshots": [],
  "unresolved": []
}
